{"response_version":"lead-response-v2","summary":"Research.","assumptions":[],"acceptance_criteria":["Facts exist."],"tasks":[{"id":"task-1","title":"Build","objective":"Build it.","acceptance_criteria":["Done."],"depends_on":[]}],"research":{"status":"required","reason_code":"official_external_facts","topic":"devops-tools","requested_count":0,"required_fields":["display_name","description","tags","official_url","source_url"],"source_policy":"official-devops-tools-v1"}}
