{"response_version":"lead-response-v2","summary":"Create an official tool catalog.","assumptions":[],"acceptance_criteria":["Eight sourced tools are shown."],"tasks":[{"id":"task-1","title":"Build catalog","objective":"Create the sourced tool catalog.","acceptance_criteria":["All validated facts are displayed."],"depends_on":[]}],"research":{"status":"required","reason_code":"official_documentation_links","topic":"devops-tools","requested_count":8,"required_fields":["display_name","description","tags","official_url","source_url"],"source_policy":"official-devops-tools-v1"}}
